{
  "schemaVersion": 1,
  "id": "counterpoint-demo",
  "targetStanceID": "stance-demo",
  "targetStanceRevision": 1,
  "scopeID": "scope-demo",
  "mode": "counterpoint",
  "state": "proposed",
  "relations": [
    {
      "id": "relation-demo",
      "evidenceIDs": [
        "ev-2-0",
        "ev-2-1",
        "ev-2-2"
      ],
      "relation": "qualifies",
      "explanation": "Der Betriebsaufwand wird unter Voraussetzung einer freigegebenen Netznutzung betrachtet; das ist keine Widerlegung des Offline-Bedarfs.",
      "reviewStatus": "proposed"
    }
  ],
  "planID": "plan-demo"
}
